<?xml version="1.0" encoding="UTF-8"?>
<!DOCTYPE assessment_demographics SYSTEM "assessment_demographics.dtd">
<assessment_demographics>
<id>770e8400-e29b-41d4-a716-446655440002</id>
<assessment_id>660e8400-e29b-41d4-a716-446655440001</assessment_id>
<ethnicity>White British</ethnicity>
<primary_language>English</primary_language>
<interpreter_required>yes</interpreter_required>
<marital_status>single</marital_status>
<occupation>Teacher</occupation>
<emergency_contact_name>Example</emergency_contact_name>
<emergency_contact_phone>07700900001</emergency_contact_phone>
<emergency_contact_relationship>Spouse</emergency_contact_relationship>
<created_at>2026-04-09T10:00:00Z</created_at>
<updated_at>2026-04-09T10:00:00Z</updated_at>
</assessment_demographics>
